Rank,book title,book price,rating,author,year of publication,genre,url,image 
1,"Iron Flame (The Empyrean, 2)",18.42,4.1,Rebecca Yarros,2023,Fantasy Romance,amazon.com/Iron-Flame-Empyrean-Rebecca-Yarros/dp/1649374178/ref=zg_bs_g_books_sccl_1/143-9831347-1043253?psc=1,https://m.media-amazon.com/images/I/917Bc9C1MlL._SL1500_.jpg
2,The Woman in Me,20.93,4.5,Britney Spears,2023,Memoir,amazon.com/Woman-Me-Britney-Spears/dp/1668009048/ref=zg_bs_g_books_sccl_2/143-9831347-1043253?psc=1,https://m.media-amazon.com/images/I/61EhCaSl-2L._SL1500_.jpg
3,My Name Is Barbra,31.5,4.5,Barbra Streisand,2023,Autobiography,amazon.com/My-Name-Barbra-Streisand/dp/0525429522/ref=zg_bs_g_books_sccl_3/143-9831347-1043253?psc=1,https://m.media-amazon.com/images/I/71musw9bJWL._SL1500_.jpg
4,"Friends, Lovers, and the Big Terrible Thing: A Memoir",23.99,4.4,Matthew Perry,2023,Memoir,amazon.com/Friends-Lovers-Big-Terrible-Thing/dp/1250866448/ref=zg_bs_g_books_sccl_4/143-9831347-1043253?psc=1,https://m.media-amazon.com/images/I/81tdvyI0MeL._SL1500_.jpg
5,How to Catch a Turkey,5.65,4.8,Adam Wallace,2018,"Childrens, Fiction",amazon.com/How-Catch-Turkey-Adam-Wallace/dp/1492664359/ref=zg_bs_g_books_sccl_5/143-9831347-1043253?psc=1,https://m.media-amazon.com/images/I/81P9B8sY4AL._SL1500_.jpg
6,"Fourth Wing (The Empyrean, 1)",16.99,4.8,Rebecca Yarros,2023,Fantasy,amazon.com/Fourth-Wing-Empyrean-Rebecca-Yarros/dp/1649374046/ref=zg_bs_g_books_sccl_6/143-9831347-1043253?psc=1,https://m.media-amazon.com/images/I/91n7p-j5aqL._SL1500_.jpg
7,Unwoke: How to Defeat Cultural Marxism in America,27.43,4.3,Unknown,2023,"Nonfiction, Politics",amazon.com/Unwoke-Defeat-Cultural-Marxism-America/dp/1684513626/ref=zg_bs_g_books_sccl_7/143-9831347-1043253?psc=1,https://m.media-amazon.com/images/I/71i28tIt92L._SL1500_.jpg
8,No Brainer (Diary of a Wimpy Kid Book 18),8.55,4.8,Jeff Kinney,2023,"Humor, Middle Grade",amazon.com/Brainer-Diary-Wimpy-Kid-Book/dp/1419766945/ref=zg_bs_g_books_sccl_8/143-9831347-1043253?psc=1,https://m.media-amazon.com/images/I/71pL+3nMzfL._SL1475_.jpg
9,Killers of the Flower Moon: The Osage Murders and the Birth of the FBI,9.86,4.4,David Grann,2017,"Nonfiction, True Crime",amazon.com/Killers-Flower-Moon-Osage-Murders/dp/0307742482/ref=zg_bs_g_books_sccl_9/143-9831347-1043253?psc=1,https://m.media-amazon.com/images/I/819bD-wfwoL._SL1500_.jpg
10,All the Light We Cannot See: A Novel,11.98,4.5,Anthony Doerr,2014,Historical Fiction,amazon.com/All-Light-We-Cannot-See/dp/1501173219/ref=zg_bs_g_books_sccl_10/143-9831347-1043253?psc=1,https://m.media-amazon.com/images/I/81RBTG28sCL._SL1500_.jpg
11,The Ballad of Songbirds and Snakes (A Hunger Games Novel) (The Hunger Games),10.99,4.6,Suzanne Collins,2020,"Adventure, War, Science fiction, Romance, Action, Thriller",amazon.com/Ballad-Songbirds-Snakes-Hunger-Games/dp/1339016575/ref=zg_bs_g_books_sccl_11/143-9831347-1043253?psc=1,https://m.media-amazon.com/images/I/81EGcrHKG-L._SL1500_.jpg
12,Night (Night),6.26,4.7,Elie Wiesel,1960,Memoir,amazon.com/Night-Elie-Wiesel/dp/0374500010/ref=zg_bs_g_books_sccl_12/143-9831347-1043253?psc=1,https://m.media-amazon.com/images/I/81JmqR3cjwL._SL1500_.jpg
13,Atomic Habits: An Easy & Proven Way to Build Good Habits & Break Bad Ones,13.79,4.8,James Clear,2018,"Self-improvement, Nonfiction",amazon.com/Atomic-Habits-Proven-Build-Break/dp/0735211299/ref=zg_bs_g_books_sccl_13/143-9831347-1043253?psc=1,https://m.media-amazon.com/images/I/81YkqyaFVEL._SL1500_.jpg
14,Stocking Stuffer Mad Libs: World's Greatest Word Game,2.79,4.8,Leigh Olsen,2018,"Childrens, Storytime,Fiction",amazon.com/Stocking-Stuffer-Libs-Leigh-Olsen/dp/1524788139/ref=zg_bs_g_books_sccl_14/143-9831347-1043253?psc=1,https://m.media-amazon.com/images/I/81IvE9jLmkL._SL1500_.jpg
15,The 48 Laws of Power,13.82,4.7,Robert Greene,1998,Nonfiction,amazon.com/48-Laws-Power-Robert-Greene/dp/0140280197/ref=zg_bs_g_books_sccl_15/143-9831347-1043253?psc=1,https://m.media-amazon.com/images/I/611X8GI7hpL._SL1500_.jpg
16,The Great Disappearance: 31 Ways to be Rapture Ready,18.84,4.6,David Jeremiah,2023,"Spiritual Warfare, Biblical Studies - Prophecy, Christian Theology - Eschatology",amazon.com/Great-Disappearance-Ways-Rapture-Ready/dp/078525224X/ref=zg_bs_g_books_sccl_16/143-9831347-1043253?psc=1,https://m.media-amazon.com/images/I/71n-Nc4s1TL._SL1500_.jpg
17,Lessons in Chemistry: A Novel,15.37,4.6,Bonnie Garmus,2022,"Fiction, Historical Fiction",amazon.com/Lessons-Chemistry-Novel-Bonnie-Garmus/dp/038554734X/ref=zg_bs_g_books_sccl_17/143-9831347-1043253?psc=1,https://m.media-amazon.com/images/I/71dQACXhz6L._SL1500_.jpg
18,The Exchange: After The Firm (The Firm Series),18.96,4.1,John Grisham,2023,"Literary, Thrillers - Suspense",amazon.com/Exchange-After-Firm/dp/0385548958/ref=zg_bs_g_books_sccl_18/143-9831347-1043253?psc=1,https://m.media-amazon.com/images/I/91JcY79rODL._SL1500_.jpg
19,Taylor Swift: A Little Golden Book Biography,4.78,4.9, Wendy Loggia,2023,"Picture Books, Biography",amazon.com/Taylor-Swift-Little-Golden-Biography/dp/0593566718/ref=zg_bs_g_books_sccl_19/143-9831347-1043253?psc=1,https://m.media-amazon.com/images/I/81NsX5gOJkL._SL1500_.jpg
20,Don't Let the Pigeon Drive the Sleigh!,11.99,4.8,Mo Willems,2023,"Picture Books, Christmas, Holiday, Humor, Childrens, Fiction, Animals",amazon.com/Dont-Let-Pigeon-Drive-Sleigh/dp/1454952776/ref=zg_bs_g_books_sccl_20/143-9831347-1043253?psc=1,https://m.media-amazon.com/images/I/71K6AwB6FRL._SL1500_.jpg
21,Turkey Trouble,8.79,4.8,Wendi Silvano,2009,"Picture Books, Childrens, Holiday, Animals, Humor, Storytime, Fiction",amazon.com/Turkey-Trouble-Wendi-Silvano/dp/0761455299/ref=zg_bs_g_books_sccl_21/143-9831347-1043253?psc=1,https://m.media-amazon.com/images/I/91QEOvkzI9L._SL1500_.jpg
22,"The Body Keeps the Score: Brain, Mind, and Body in the Healing of Trauma",9.68,4.8,Bessel van der Kolk,2014,"Nonfiction, Psychology, Self Help, Mental Health, Health, Science",amazon.com/Body-Keeps-Score-Healing-Trauma/dp/0143127748/ref=zg_bs_g_books_sccl_22/143-9831347-1043253?psc=1,https://m.media-amazon.com/images/I/71Ha3OShqSL._SL1500_.jpg
23,"A Court of Thorns and Roses (A Court of Thorns and Roses, 1)",8.89,4.6,Sarah J. Maas,2015,"Fantasy, Romance, Young Adult, Fiction, New Adult, Fae",amazon.com/Court-Thorns-Roses-Sarah-Maas/dp/1635575567/ref=zg_bs_g_books_sccl_23/143-9831347-1043253?psc=1,https://m.media-amazon.com/images/I/81RrEEMiOCL._SL1500_.jpg
24,A Little Life,11.83,4.5,Hanya Yanagihara,2015,"Fiction, Contemporary, LGBT, Literary Fiction, Queer, Adult, Mental Health",amazon.com/Little-Life-Hanya-Yanagihara/dp/0804172706/ref=zg_bs_g_books_sccl_24/143-9831347-1043253?psc=1,https://m.media-amazon.com/images/I/71If19m2RXL._SL1200_.jpg
26,"World of Eric Carle, Around the Farm 30-Button Animal Sound Book - Great for First Words - PI Kids",9.43,4.8,Editors of Publications International,2013,"Childrens, Activities, Crafts, Games",amazon.com/World-Carle-Around-Play-Sound/dp/1450805752/ref=zg_bs_g_books_sccl_26/143-9831347-1043253?psc=1,https://m.media-amazon.com/images/I/91WyMdm13iL._SL1500_.jpg
27,"Goodnight, Goodnight Construction Site (Board Book for Toddlers, Children's Board Book)",3.78,4.9,Sherri Duskey Rinker,2011,"Picture Book, Cars and Trucks",amazon.com/Goodnight-Construction-Sherri-Duskey-Rinker/dp/1452111731/ref=zg_bs_g_books_sccl_27/143-9831347-1043253?psc=1,https://m.media-amazon.com/images/I/913nY-+HJIL._SL1500_.jpg
28,The Leaf Thief: (The Perfect Fall Book for Children and Toddlers),10.39,4.8,Alice Hemming,2021,Childrens,amazon.com/Leaf-Thief-Alice-Hemming/dp/1728235200/ref=zg_bs_g_books_sccl_28/143-9831347-1043253?psc=1,https://m.media-amazon.com/images/I/A18OnuYW2dL._SL1500_.jpg
29,Murtagh: The World of Eragon (The Inheritance Cycle),22.48,4.8,Christopher Paolini,2023,"Fantasy, Dragons, Young Adult, Fiction, High Fantasy, Magic, Science Fiction, Fantasy",amazon.com/Murtagh-World-Eragon-Inheritance-Cycle/dp/0593650867/ref=zg_bs_g_books_sccl_29/143-9831347-1043253?psc=1,https://m.media-amazon.com/images/I/91wdQgKfTsL._SL1500_.jpg
30,"Brown Bear, Brown Bear, What Do You See?",4.94,4.9,Bill Martin Jr.,1967,"Picture Book, Colors, Wild Animals",amazon.com/Brown-Bear-What-You-See/dp/0805047905/ref=zg_bs_g_books_sccl_30/143-9831347-1043253?psc=1,https://m.media-amazon.com/images/I/81kZ3Gl3WKL._SL1500_.jpg
31,Balloons over Broadway: The True Story of the Puppeteer of Macy's Parade (Bank Street College of Education Flora Stieglitz St,12.19,4.9,Bill Martin Jr.,1967,"Childrens, literature",amazon.com/Balloons-over-Broadway-Puppeteer-Education/dp/0547199457/ref=zg_bs_g_books_sccl_31/143-9831347-1043253?psc=1,https://m.media-amazon.com/images/I/81ycxEs6EqL._SL1500_.jpg
32,The Four Agreements: A Practical Guide to Personal Freedom (A Toltec Wisdom Book),7.74,4.7,Melissa Sweet,2011,Picture Book,amazon.com/Four-Agreements-Practical-Personal-Freedom/dp/1878424319/ref=zg_bs_g_books_sccl_32/143-9831347-1043253?psc=1,https://m.media-amazon.com/images/I/91rR9gMuOVL._SL1500_.jpg
33,The Housemaid,8.11,4.5,Don Miguel Ruiz,1997,"Spirituality, self-help, personal growth",amazon.com/Housemaid-Freida-McFadden/dp/1538742578/ref=zg_bs_g_books_sccl_33/143-9831347-1043253?psc=1,https://m.media-amazon.com/images/I/81AHTyq2wVL._SL1500_.jpg
34,How to Know a Person: The Art of Seeing Others Deeply and Being Deeply Seen,19.89,4.5,Alice Walstead,2022,"Thriller, mystery, suspense",amazon.com/How-Know-Person-Seeing-Others/dp/059323006X/ref=zg_bs_g_books_sccl_34/143-9831347-1043253?psc=1,https://m.media-amazon.com/images/I/81Gvt3v-J3L._SL1500_.jpg
35,The Very Hungry Caterpillar,5.9,4.9,David Brooks,2023,Nonfiction,amazon.com/Very-Hungry-Caterpillar-Eric-Carle/dp/0399226907/ref=zg_bs_g_books_sccl_35/143-9831347-1043253?psc=1,https://m.media-amazon.com/images/I/81qsstEtrgL._SL1500_.jpg
36,How to Catch a Reindeer,5.99,4.8,Eric Carle,1969,"Childrens, literature",amazon.com/How-Catch-Reindeer-Alice-Walstead/dp/1728276136/ref=zg_bs_g_books_sccl_36/143-9831347-1043253?psc=1,https://m.media-amazon.com/images/I/91TBEE7LPsL._SL1500_.jpg
37,Pookie's Thanksgiving (Little Pookie),6.99,4.9,Alice Walstead,2022,"Childrens, literature",amazon.com/Pookies-Thanksgiving-Little-Pookie-Boynton/dp/166592263X/ref=zg_bs_g_books_sccl_37/143-9831347-1043253?psc=1,https://m.media-amazon.com/images/I/71PV2IkwYoL._SL1500_.jpg
38,"The Psychology of Money: Timeless lessons on wealth, greed, and happiness",12.68,4.7,Sandra Boynton,2022,"Picture Books, Childrens, Holiday",amazon.com/Psychology-Money-Timeless-lessons-happiness/dp/0857197681/ref=zg_bs_g_books_sccl_38/143-9831347-1043253?psc=1,https://m.media-amazon.com/images/I/71aG0m9XRcL._SL1500_.jpg
39,The Seven Husbands of Evelyn Hugo: A Novel,9.49,4.6,Morgan Housel,2020,"Finance, Nonfiction, Psychology, Business, Self Help, Money, Economics",amazon.com/Seven-Husbands-Evelyn-Hugo-Novel/dp/1501161938/ref=zg_bs_g_books_sccl_39/143-9831347-1043253?psc=1,https://m.media-amazon.com/images/I/71KcUgYanhL._SL1500_.jpg
40,I Love You to the Moon and Back,4.76,4.9,Taylor Jenkins Reid,2017,Historical Fiction,amazon.com/I-Love-You-Moon-Back/dp/1589255518/ref=zg_bs_g_books_sccl_40/143-9831347-1043253?psc=1,https://m.media-amazon.com/images/I/81mpSoJzv4L._SL1446_.jpg
41,Outlive: The Science and Art of Longevity,16.99,4.7,Peter Attia,2023,"Health, Nonfiction, Science, Self Help",amazon.com/Outlive-Longevity-Peter-Attia-MD/dp/0593236599/ref=zg_bs_g_books_sccl_41/143-9831347-1043253?psc=1,https://m.media-amazon.com/images/I/71X9FMy66NL._SL1500_.jpg
42,Hundred Years' War on Palestine,12.99,4.6,Rashid Khalidi,2019,"History, Nonfiction, Politics, War",amazon.com/Hundred-Years-War-Palestine-Colonialism/dp/1250787653/ref=zg_bs_g_books_sccl_42/143-9831347-1043253?psc=1,https://m.media-amazon.com/images/I/81fEw8i8omL._SL1500_.jpg
43,Little Blue Truck's Christmas: A Christmas Holiday Book for Kids,11.2,4.8,Alice Schertle,2014,"Childrens, literature",amazon.com/Little-Trucks-Christmas-Alice-Schertle/dp/0544320417/ref=zg_bs_g_books_sccl_43/143-9831347-1043253?psc=1,https://m.media-amazon.com/images/I/81PNtM1NfxL._SL1500_.jpg
44,Goodnight Moon,5.36,4.9,Margaret Wise Brown,1947,"Childrens, literature",amazon.com/Goodnight-Moon-Margaret-Wise-Brown/dp/0694003611/ref=zg_bs_g_books_sccl_44/143-9831347-1043253?psc=1,https://m.media-amazon.com/images/I/81t-IstQ+ZL._SL1500_.jpg
45,I Am Thankful: A Thanksgiving Book for Kids,7.99,4.7,Sheri Wall,2020,"Picture Books, Childrens",amazon.com/Am-Thankful-Thanksgiving-Book-Kids/dp/1646115538/ref=zg_bs_g_books_sccl_45/143-9831347-1043253?psc=1,https://m.media-amazon.com/images/I/71SZtWuFNDL._SL1400_.jpg
47,A Court of Thorns and Roses Paperback Box Set (5 books),48.77,4.8,Sarah J. Maas,2021,"Fantasy, Romance",amazon.com/Court-Thorns-Roses-Paperback-books/dp/1639730192/ref=zg_bs_g_books_sccl_47/143-9831347-1043253?psc=1,https://m.media-amazon.com/images/I/81h4xinmqmL._SL1500_.jpg
48,Where's Bluey?: A Search-and-Find Book,6.93,4.8, Penguin Young Readers Licenses (,2022,"Childrens, Storytime,Fiction",amazon.com/Wheres-Bluey-Search-Find-Book/dp/0593385691/ref=zg_bs_g_books_sccl_48/143-9831347-1043253?psc=1,https://m.media-amazon.com/images/I/81EmtXw0mrL._SL1500_.jpg
49,The Wonderful Things You Will Be,9.4,4.9,Emily Winfield Martin,2015,"Picture Books, Childrens, Fiction, Poetry",amazon.com/Wonderful-Things-You-Will-Be/dp/0385376715/ref=zg_bs_g_books_sccl_49/143-9831347-1043253?psc=1,https://m.media-amazon.com/images/I/610gwIC++LL._SL1200_.jpg
50,How to Catch a Dinosaur,4.66,4.8,Adam Wallace,2019,"Picture Books, Dinosaurs, Childrens, Fiction, Storytime, Fantasy, Animals",amazon.com/How-Catch-Dinosaur-Adam-Wallace/dp/1492680524/ref=zg_bs_g_books_sccl_50/143-9831347-1043253?psc=1,https://m.media-amazon.com/images/I/91jwRAg09EL._SL1500_.jpg
51,Hidden Potential: The Science of Achieving Greater Things,21,4.4,Adam M. Grant,2023,"Nonfiction, Self Help, Psychology, Business, Leadership, Personal Development",amazon.com/Hidden-Potential-Science-Achieving-Greater/dp/0593653149/ref=zg_bs_g_books_sccl_1/142-7825522-0098658?psc=1,https://m.media-amazon.com/images/I/71BE9mg4xRL._SL1500_.jpg
52,Resurrection Walk (Lincoln Lawyer),20.98,5,Michael Connelly,2023,"Fiction, Mystery, Thriller, Suspense, Crime, Legal Thriller",amazon.com/Resurrection-Walk-Michael-Connelly/dp/0316563765/ref=zg_bs_g_books_sccl_2/142-7825522-0098658?psc=1,https://m.media-amazon.com/images/I/91ZdmWrS2FL._SL1500_.jpg
53,The Christmas Fix,9.49,4.6,Lucy Score,2017,"Christmas, Romance, Holiday, Contemporary Romance, Contemporary Fiction, Humor",amazon.com/Christmas-Fix-Lucy-Score/dp/1728295149/ref=zg_bs_g_books_sccl_3/142-7825522-0098658?psc=1,https://m.media-amazon.com/images/I/81mc3ShZMJL._SL1500_.jpg
54,Flash Cards: Sight Words,2.88,4.8, Scholastic,2018,"Educational Material, Childrens",amazon.com/Flash-Cards-Scholastic-Teacher-Resources/dp/1338233580/ref=zg_bs_g_books_sccl_4/142-7825522-0098658?psc=1,https://m.media-amazon.com/images/I/71HtAExOQjL._SL1500_.jpg
55,I Love You Like No Otter: A Funny and Sweet Animal Board Book for Babies and Toddlers this Christmas (Punderland),5.37,4.9,Rose Rossner,2020,"Picture Books, Animals, Childrens, Fiction, Love, Family, Humor",amazon.com/Love-You-Like-No-Otter/dp/1728213746/ref=zg_bs_g_books_sccl_5/142-7825522-0098658?psc=1,https://m.media-amazon.com/images/I/81a5X+c7kkL._SL1500_.jpg
56,Chicka Chicka Boom Boom (Board Book),4.32,4.9,"Bill Martin Jr., John Archambault",1989,"Fiction, Alphabet",amazon.com/Chicka-Boom-Board-Book/dp/1442450703/ref=zg_bs_g_books_sccl_6/142-7825522-0098658?psc=1,https://m.media-amazon.com/images/I/51WABgZmdWL._SL1000_.jpg
57,"From Crook to Cook: Platinum Recipes from Tha Boss Dogg's Kitchen (Snoop Dogg Cookbook, Celebrity Cookbook with Soul Food Rec",12.15,4.8,Snoop Dogg,2018,"Cookbooks, Cooking",amazon.com/Crook-Cook-Platinum-Recipes-Kitchen/dp/1452179611/ref=zg_bs_g_books_sccl_7/142-7825522-0098658?psc=1,https://m.media-amazon.com/images/I/91vD4ftg5XL._SL1500_.jpg
58,The Shadow Work Journal: A Guide to Integrate and Transcend your Shadows,17.28,4.6,Keila Shaheen,2021,"Self Help, Psychology",amazon.com/Shadow-Work-Journal-Integrate-Transcend/dp/B09KN2QCML/ref=zg_bs_g_books_sccl_8/142-7825522-0098658?psc=1,https://m.media-amazon.com/images/I/51cB5c5e1DL._SL1499_.jpg
59,"Interesting Facts For Curious Minds: 1572 Random But Mind-Blowing Facts About History, Science, Pop Culture And Everything In",12.89,4.6,Jordan Moore,2022,Nonfiction,amazon.com/Interesting-Facts-Curious-Minds-Mind-Blowing/dp/B0B6XFT4RH/ref=zg_bs_g_books_sccl_9/142-7825522-0098658?psc=1,https://m.media-amazon.com/images/I/718SstStV3L._SL1430_.jpg
60,There Was an Old Lady Who Swallowed a Turkey!,6.28,4.8,Lucille Colandro,2016,"Picture Books, Holiday, Childrens, Fiction, Storytime, Humor",amazon.com/There-Was-Lady-Swallowed-Turkey/dp/0545931908/ref=zg_bs_g_books_sccl_10/142-7825522-0098658?psc=1,https://m.media-amazon.com/images/I/A132ZNwaZbL._SL1500_.jpg
61,Elon Musk,20.99,4.7,Walter Isaacson,2023,"Biography, Nonfiction, Business, Technology",amazon.com/Elon-Musk-Walter-Isaacson/dp/1982181281/ref=zg_bs_g_books_sccl_11/142-7825522-0098658?psc=1,https://m.media-amazon.com/images/I/81Kaj5++6pL._SL1500_.jpg
62,The Complete Cookbook for Young Chefs: 100+ Recipes that You'll Love to Cook and Eat,9.97,4.8,Americas Test Kitchen Kids,2018,Cookbook,amazon.com/Complete-Cookbook-Young-Chefs/dp/1492670022/ref=zg_bs_g_books_sccl_12/142-7825522-0098658?psc=1,https://m.media-amazon.com/images/I/911pI+iDkCL._SL1500_.jpg
63,Llama Llama Gives Thanks,5.67,4.7,Anna Dewdney,2017,"Picture Books, Childrens, Holiday, Animals, Kids Fiction",amazon.com/Llama-Gives-Thanks-Anna-Dewdney/dp/110199715X/ref=zg_bs_g_books_sccl_13/142-7825522-0098658?psc=1,https://m.media-amazon.com/images/I/91kH-4WtNRL._SL1500_.jpg
64,Tom Lake: A Reese's Book Club Pick,15.33,4.3,Ann Patchett,2023,"Literary, Medical, Family Life - General, World Literature - India - General",amazon.com/Tom-Lake-Novel-Ann-Patchett/dp/006332752X/ref=zg_bs_g_books_sccl_14/142-7825522-0098658?psc=1,https://m.media-amazon.com/images/I/91p-s-UhmzL._SL1500_.jpg
65,The Covenant of Water (Oprah's Book Club),16.79,4.6,Abraham Verghese,2023,"Fiction, Mystery",amazon.com/Covenant-Water-Abraham-Verghese/dp/0802162177/ref=zg_bs_g_books_sccl_15/142-7825522-0098658?psc=1,https://m.media-amazon.com/images/I/91b7tm523VL._SL1500_.jpg
66,Dirty Thirty (30) (Stephanie Plum),20.98,4.7,Janet Evanovich,2021,"Dark, Thriller, Fantasy, Adult, Contemporary, Mystery, Horror",amazon.com/Dirty-Thirty-30-Stephanie-Plum/dp/1668003090/ref=zg_bs_g_books_sccl_16/142-7825522-0098658?psc=1,https://m.media-amazon.com/images/I/71grtUVoFbL._SL1500_.jpg
67,How to Catch an Elf,6.94,4.8,Adam Wallace,2016,"Christmas, Picture Books, Holiday, Childrens, Fantasy, Humor, Fiction",amazon.com/How-Catch-Elf-Adam-Wallace/dp/1492646318/ref=zg_bs_g_books_sccl_17/142-7825522-0098658?psc=1,https://m.media-amazon.com/images/I/81RoKt2gqWL._SL1500_.jpg
68,"School Zone - Multiplication 0-12 Flash Cards - Ages 8+, 3rd Grade, 4th Grade, Elementary Math, Multiplication Facts, Common ",2.78,4.7,School Zone Publishing,1994,Educational Material,amazon.com/School-Zone-Multiplication-Grades-Concentration/dp/0938256939/ref=zg_bs_g_books_sccl_18/142-7825522-0098658?psc=1,https://m.media-amazon.com/images/I/715AP6HQifL._SL1500_.jpg
69,"Hello, Baby Animals: A Durable High-Contrast Black-and-White Board Book for Newborns and Babies (High-Contrast Books)",4.73,4.9,"duopress labs, Julissa Mora",2016,"Childrens, Picture Books, Animals",amazon.com/Hello-Baby-Animals-High-Contrast-Book/dp/1938093682/ref=zg_bs_g_books_sccl_19/142-7825522-0098658?psc=1,https://m.media-amazon.com/images/I/71wxlMQUZOL._SL1500_.jpg
70,Haunting Adeline (Cat and Mouse Duet),13.36,4.4,H.D. Carlton,2021,"Dark, Thriller, Fantasy, Adult, Contemporary, Mystery, Horror",amazon.com/Haunting-Adeline-Cat-Mouse-Duet/dp/B09CGGV8DX/ref=zg_bs_g_books_sccl_20/142-7825522-0098658?psc=1,https://m.media-amazon.com/images/I/71W5-2NdNsL._SL1500_.jpg
71,Verity,10.98,4.6,Colleen Hoover,2018,"Thriller, Romance, Mystery, Fiction",amazon.com/Verity-Colleen-Hoover/dp/1538724731/ref=zg_bs_g_books_sccl_21/142-7825522-0098658?psc=1,https://m.media-amazon.com/images/I/917iVfhEhxL._SL1500_.jpg
72,"A Court of Mist and Fury (A Court of Thorns and Roses, 2)",12.79,4.8,Sarah J. Maas,2016,"Fantasy, Romance, Young Adult, New Adult, Fiction",amazon.com/Court-Mist-Fury-Thorns-Roses/dp/1635575583/ref=zg_bs_g_books_sccl_22/142-7825522-0098658?psc=1,https://m.media-amazon.com/images/I/812XbpMDovL._SL1500_.jpg
73,The Creative Act: A Way of Being,17.49,4.7,Rick Rubin,2023,"Nonfiction, Art, Music, Philosophy, Self Help, Writing, Design",amazon.com/Creative-Act-Way-Being/dp/0593652886/ref=zg_bs_g_books_sccl_23/142-7825522-0098658?psc=1,https://m.media-amazon.com/images/I/918EkrTDaRL._SL1500_.jpg
74,My First Library : Boxset of 10 Board Books for Kids (My First Book of),16.74,4.6,Not available,2018,Childrens,amazon.com/My-First-Library-Boxset-Board/dp/9387779262/ref=zg_bs_g_books_sccl_24/142-7825522-0098658?psc=1,https://m.media-amazon.com/images/I/711c-uf6AFL._SL1500_.jpg
75,"Forever Strong: A New, Science-Based Strategy for Aging Well",20.63,4.6,Gabrielle Lyon,2023,"Health, Nonfiction, Nutrition, Fitness, Self Help, Science",amazon.com/Forever-Strong-Science-Based-Strategy-Aging/dp/1668007878/ref=zg_bs_g_books_sccl_25/142-7825522-0098658?psc=1,https://m.media-amazon.com/images/I/81R4yeXggkL._SL1500_.jpg
76,Where's Spot?,4.97,4.9,Eric Hill,1980,Childrens,amazon.com/Wheres-Spot-Eric-Hill/dp/0399240462/ref=zg_bs_g_books_sccl_26/142-7825522-0098658?psc=1,https://m.media-amazon.com/images/I/61NQ+e7V9iL._SL1200_.jpg
77,Demon Copperhead: A Pulitzer Prize Winner,19.5,4.6,Barbara Kingsolver,2022,Fiction,amazon.com/Demon-Copperhead-Novel-Barbara-Kingsolver/dp/0063251922/ref=zg_bs_g_books_sccl_27/142-7825522-0098658?psc=1,https://m.media-amazon.com/images/I/918DFDx5ZRL._SL1500_.jpg
78,Israel: A Simple Guide to the Most Misunderstood Country on Earth,15.59,4.7,Noa Tishby,2021,"Nonfiction, History, Politics, Israel, Jewish, Judaism, Religion",amazon.com/Israel-Simple-Guide-Misunderstood-Country/dp/1982144947/ref=zg_bs_g_books_sccl_28/142-7825522-0098658?psc=1,https://m.media-amazon.com/images/I/71NAeb2PCLL._SL1500_.jpg
79,Remarkably Bright Creatures: A Read with Jenna Pick,15.99,4.6,Shelby Van Pelt,2024,Fiction,amazon.com/Remarkably-Bright-Creatures-Shelby-Pelt/dp/0063204150/ref=zg_bs_g_books_sccl_29/142-7825522-0098658?psc=1,https://m.media-amazon.com/images/I/81X7rAcaQkL._SL1500_.jpg
80,Harry Potter Paperback Box Set (Books 1-7),45.22,4.9,J.K. Rowling,2014,"Childrens, Young Adult, Fantasy, Science Fiction &amp; Horror",amazon.com/Harry-Potter-Paperback-Box-Books/dp/0545162076/ref=zg_bs_g_books_sccl_30/142-7825522-0098658?psc=1,https://m.media-amazon.com/images/I/81GJMtnxqDL._SL1500_.jpg
81,Just Because,12.69,4.6,Matthew McConaughey,2023,"Picture Books, Childrens, Fiction",amazon.com/Just-Because-Matthew-McConaughey/dp/0593622030/ref=zg_bs_g_books_sccl_81/142-7825522-0098658?psc=1,https://m.media-amazon.com/images/I/81dEhELNVAL._SL1500_.jpg
82,If Animals Kissed Good Night,4.19,4.8,Ann Whitford Paul,2008,"Picture Books, Childrens, Animals, Fiction, Family, Storytime, Poetry",amazon.com/If-Animals-Kissed-Good-Night/dp/0374300216/ref=zg_bs_g_books_sccl_82/142-7825522-0098658?psc=1,https://m.media-amazon.com/images/I/81nzxODnaJL._SL1401_.jpg
83,Things We Never Got Over (Knockemout),8.93,4.5,Lucy Score,2022,"Romance, Contemporary, Contemporary Romance, Fiction, Adult, Chick Lit",amazon.com/Things-We-Never-Got-Over/dp/194563183X/ref=zg_bs_g_books_sccl_83/142-7825522-0098658?psc=1,https://m.media-amazon.com/images/I/81WklxcuSZL._SL1500_.jpg
84,Five Silly Turkeys,5.99,4.8,Salina Yoon,2005,"Picture Books, Childrens, Holiday, Storytime, Counting, Animals, Number",amazon.com/Five-Silly-Turkeys-Salina-Yoon/dp/0843114169/ref=zg_bs_g_books_sccl_84/142-7825522-0098658?psc=1,https://m.media-amazon.com/images/I/715ozS3uYBL._SL1200_.jpg
85,Paint by Sticker Kids: Christmas: Create 10 Pictures One Sticker at a Time! Includes Glitter Stickers,6.06,4.8,Workman Publishing,2019,Childrens Literature,amazon.com/Paint-Sticker-Kids-Workman-Publishing/dp/152350675X/ref=zg_bs_g_books_sccl_85/142-7825522-0098658?psc=1,https://m.media-amazon.com/images/I/81GXl0dweAL._SL1500_.jpg
87,The Ballad of Songbirds and Snakes (A Hunger Games Novel) (The Hunger Games),15.79,4.6,Suzanne Collins,2020,"Adventure, War, Science Fiction, Romance, Action, Thriller",amazon.com/Ballad-Songbirds-Snakes-Hunger-Games/dp/1338635174/ref=zg_bs_g_books_sccl_87/142-7825522-0098658?psc=1,https://m.media-amazon.com/images/I/819tY-gDcWL._SL1500_.jpg
88,"A Court of Wings and Ruin (A Court of Thorns and Roses, 3)",11.56,4.8,Sarah J. Maas,2017,Fantasy,amazon.com/Court-Wings-Ruin-Thorns-Roses/dp/1635575605/ref=zg_bs_g_books_sccl_88/142-7825522-0098658?psc=1,https://m.media-amazon.com/images/I/81U27X4m6EL._SL1500_.jpg
89,The Shadow Work Journal 2nd Edition: a Guide to Integrate and Transcend Your Shadows: The Essential Guidebook for Shadow Work,18.46,4.7,Keila Shaheen,2023,Self Help,amazon.com/Shadow-Work-Journal-2nd-Integrate/dp/B0BW31X61X/ref=zg_bs_g_books_sccl_89/142-7825522-0098658?psc=1,https://m.media-amazon.com/images/I/61aYD5zeQpL._SL1360_.jpg
90,"Harry Potter and the Prisoner of Azkaban (Harry Potter, Book 3) (MinaLima Edition)",25.97,4.9,J.K. Rowling,1999,Fantasy,amazon.com/Harry-Potter-Prisoner-Azkaban-MinaLima/dp/1338815288/ref=zg_bs_g_books_sccl_90/142-7825522-0098658?psc=1,https://m.media-amazon.com/images/I/71NaVwWsRDL._SL1038_.jpg
91,"Moo, Baa, La La La!",3.69,4.9,Sandra Boynton,1982,"Childrens literature, picture book",amazon.com/Moo-Baa-Sandra-Boynton/dp/067144901X/ref=zg_bs_g_books_sccl_91/142-7825522-0098658?psc=1,https://m.media-amazon.com/images/I/61Pkr5zTX0L._SL1400_.jpg
